{
  "project": {
    "name": "test-postgresql",
    "hostname": "dev.postgresql.local",
    "workspace_path": "/workspace"
  },
  "provider": "docker",
  "terminal": {
    "emoji": "ðŸ§ª",
    "username": "test-dev"
  },
  "services": {
    "postgresql": {
      "enabled": true
    }
  },
  "aliases": {}
}
